{
  "$schema": "https://json-schema.org/draft/2020-12/schema",
  "$id": "https://github.com/zz-howard/chatweave/schemas/v0.1/message.schema.json",
  "title": "ChatWeave Message (draft 0.1)",
  "description": "DRAFT. A chat message as persisted by the host and synced to clients: an ordered list of content blocks plus a mandatory plain-text fallback. After reconnect or offline, the persisted message (higher rev) always wins over a locally assembled stream state.",
  "type": "object",
  "required": ["id", "protocolVersion", "role", "status", "blocks", "fallbackText", "rev", "createdAt"],
  "additionalProperties": false,
  "properties": {
    "id": {
      "description": "Message id. User messages: generated by the sending client (UUIDv7 recommended), doubling as the idempotency key for offline queues and retries; the server validates and adopts it unchanged, and the optimistic local copy is reconciled by this same id. Assistant / system messages: server-generated only.",
      "$ref": "action.schema.json#/$defs/messageId"
    },
    "protocolVersion": { "type": "string", "pattern": "^[0-9]+\\.[0-9]+$" },
    "conversationId": { "$ref": "action.schema.json#/$defs/messageId" },
    "role": { "type": "string", "enum": ["assistant", "user", "system"] },
    "status": {
      "description": "streaming: still being produced. complete: finished normally. interrupted: producer stopped early (crash, cancel, upstream failure); content so far is kept. error: nothing usable was produced; fallbackText explains.",
      "type": "string",
      "enum": ["streaming", "complete", "interrupted", "error"]
    },
    "blocks": {
      "type": "array",
      "maxItems": 64,
      "items": { "$ref": "content-block.schema.json" }
    },
    "fallbackText": {
      "description": "Whole-message plain text. Always present, also for status 'error'. Markdown-only clients render just this.",
      "type": "string",
      "maxLength": 16000
    },
    "rev": {
      "description": "Persisted revision. 1 when the message is first completed; +1 for every later change (e.g. a choice block resolved).",
      "type": "integer",
      "minimum": 0
    },
    "createdAt": { "type": "string", "format": "date-time" },
    "completedAt": { "type": "string", "format": "date-time" },
    "metadata": {
      "description": "Opaque host data (e.g. trace ids). Never rendered by the library.",
      "type": "object",
      "maxProperties": 16
    },
    "view": {
      "description": "RESERVED for the Phase 2 View protocol (layout planning that references block data by id). Must not be emitted in 0.1; clients ignore it.",
      "not": {}
    }
  },
  "allOf": [
    {
      "if": { "properties": { "status": { "const": "streaming" } } },
      "then": { "properties": { "rev": { "const": 0 } } },
      "else": { "properties": { "rev": { "minimum": 1 } } }
    },
    {
      "$comment": "Client-generated user message ids double as idempotency keys, so they must be long enough to be unique (same rule as action ids). The former separate clientMessageId field was removed (see decisions D43).",
      "if": { "properties": { "role": { "const": "user" } }, "required": ["role"] },
      "then": { "properties": { "id": { "pattern": "^[A-Za-z0-9][A-Za-z0-9_.:-]{7,127}$" } } }
    }
  ]
}
