{
  "id": "msg_weather",
  "protocolVersion": "0.1",
  "conversationId": "conv_weather",
  "role": "assistant",
  "status": "complete",
  "rev": 1,
  "createdAt": "2026-10-26T09:30:00Z",
  "fallbackText": "天气晴朗。最高气温18°C待办：浇花记得浇花。",
  "blocks": [
    {
      "id": "b1",
      "type": "markdown",
      "schemaVersion": 1,
      "data": {
        "text": "天气晴朗。"
      }
    },
    {
      "id": "b2",
      "type": "metric",
      "schemaVersion": 1,
      "data": {
        "label": "最高气温",
        "value": 18,
        "unit": "°C"
      },
      "fallbackText": "最高气温18°C"
    },
    {
      "id": "b3",
      "type": "dataset",
      "schemaVersion": 1,
      "data": {
        "columns": [
          {
            "key": "title",
            "label": "事项",
            "type": "string"
          }
        ],
        "rows": [
          {
            "title": "浇花"
          }
        ],
        "totalRows": 1
      },
      "fallbackText": "待办：浇花"
    },
    {
      "id": "b4",
      "type": "markdown",
      "schemaVersion": 1,
      "data": {
        "text": "记得浇花。"
      }
    }
  ]
}
